{
  "candidate_id": "TC-015",
  "passed": true,
  "checks": [
    {"check": "signal_ids_verified", "passed": true, "detail": ""},
    {"check": "candidate_generation_rules", "passed": true, "detail": ""},
    {"check": "corpus_term_polos", "passed": true, "detail": ""},
    {"check": "units_declared", "passed": true, "detail": ""},
    {"check": "supports_distinction", "passed": true, "detail": ""},
    {"check": "rejected_groupings_exist", "passed": true, "detail": ""},
    {"check": "coverage_gaps_reported", "passed": true, "detail": ""},
    {"check": "mechanical_language", "passed": true, "detail": ""},
    {"check": "type_matches_relation", "passed": true, "detail": ""},
    {"check": "signal_ids_source_verified", "passed": true, "detail": "Spot-checked SC-R1-014 (found: policy page, changes without notice, immediate effect), SC-R1-016 (found: ToS 2025, sole discretion, cannot invoice buyers), SC-R1-012 (found: policy page, prohibited due to US law/card network rules). All three confirmed in round_1.md."},
    {"check": "human_fields_empty", "passed": true, "detail": ""},
    {"check": "schema_valid", "passed": true, "detail": ""},
    {"check": "mechanical_summary_not_definition", "passed": true, "detail": ""},
    {"check": "unit_used_specific", "passed": true, "detail": ""},
    {"check": "what_it_supports_not_template", "passed": true, "detail": ""},
    {"check": "card_polo_relevance", "passed": true, "detail": "TC-015 has 3 Signal IDs, below the >15 threshold. Check not applicable; passes by default."}
  ],
  "timestamp": "2026-04-10T00:00:00Z"
}
