{
  "candidate_id": "TC-058",
  "passed": true,
  "checks": [
    {
      "check": "signal_ids_verified",
      "passed": true,
      "detail": ""
    },
    {
      "check": "candidate_generation_rules",
      "passed": true,
      "detail": ""
    },
    {
      "check": "corpus_term_polos",
      "passed": true,
      "detail": ""
    },
    {
      "check": "units_declared",
      "passed": true,
      "detail": ""
    },
    {
      "check": "supports_distinction",
      "passed": true,
      "detail": ""
    },
    {
      "check": "rejected_groupings_exist",
      "passed": true,
      "detail": ""
    },
    {
      "check": "coverage_gaps_reported",
      "passed": true,
      "detail": ""
    },
    {
      "check": "mechanical_language",
      "passed": true,
      "detail": ""
    },
    {
      "check": "type_matches_relation",
      "passed": true,
      "detail": ""
    },
    {
      "check": "signal_ids_source_verified",
      "passed": true,
      "detail": ""
    },
    {
      "check": "human_fields_empty",
      "passed": true,
      "detail": ""
    },
    {
      "check": "schema_valid",
      "passed": true,
      "detail": ""
    }
  ],
  "timestamp": "2026-04-04T19:46:19Z"
}